{"adapted_capability_id":"v8.4-adapted-kd-sympy","applicability":{"domains":["scientific-computing","symbolic-mathematics"],"exclusions":["floating-point approximation is sufficient","hardware or external-service execution"],"prerequisites":["The task requires exact symbolic reasoning rather than only an approximate numeric answer."],"task_triggers":["exact symbolic algebra","symbolic calculus","symbolic equation solving"]},"budget":{"token_count_or_null":null,"tokenizer_id_or_null":null,"unavailable_reason_or_null":"No tokenizer or model is invoked by the offline deterministic compiler.","utf8_bytes":1155},"cache_key":"097a1c6fec7c0de6456f6b3260b8982ecbb7d4b5a2ccaf27cd5bb03af88049e3","candidate_id":"kd-sympy","content_sha256":"cf6eab1a19bfddb3d1690da80f18fb06ad748a2af05687100b5285251fd50fec","contract_id":"v8.4-adapted-capability-definition-v1","knowledge_units":[{"content":"Represent exact constants with symbolic exact-number objects such as Rational or S. Do not introduce binary floating-point constants before symbolic solving or exact verification.","content_sha256":"8dbc19712697544f4313c99f625af08e02259d9cf8ed5a91edd48daa155e2b9e","failure_modes":["A decimal literal can silently turn an exact symbolic problem into an approximate one."],"kind":"RULE","prerequisites":["Represent the mathematical variables symbolically."],"priority":10,"required":true,"safety_constraints":["Do not claim an approximate value is the exact result."],"source_claim_sha256":"5900450b48778231f357eaa352aaa0c6bba01485ce20c843de3bc08863e223ea","source_locator":"evaluation/external-skills/snapshots/kd-sympy/SKILL.md#L90-L100","task_tags":["exact-arithmetic","symbolic-solving"],"unit_id":"kd-sympy.sympy-exact-arithmetic.ac4d1f7bfd3d121e","verification_requirements":["Confirm exact constants remain symbolic until an explicitly requested numerical evaluation."]},{"content":"Define symbols before building expressions and attach only assumptions justified by the problem, such as real, positive, integer, or rational domains. Track those assumptions when interpreting simplified results.","content_sha256":"280cf9003c0dcaeac581ffbaff88d3fb85399ec6ff5d50cf0b023cc8d87671ed","failure_modes":["Missing assumptions can leave absolute values or branch conditions unresolved; invented assumptions can remove valid solutions."],"kind":"PROCEDURE","prerequisites":["Identify the domain restrictions stated by the problem."],"priority":20,"required":true,"safety_constraints":["Never add a sign or domain assumption merely to obtain a simpler expression."],"source_claim_sha256":"0c9334294fde94a77917b66aa481419a794ec838e0097d7fabfe18799fb93d63","source_locator":"evaluation/external-skills/snapshots/kd-sympy/SKILL.md#L81-L86","task_tags":["assumptions","symbol-definition"],"unit_id":"kd-sympy.sympy-symbol-assumptions.e88f7fcb50ecc2bd","verification_requirements":["Check that every domain assumption is stated by or logically implied by the problem."]},{"content":"Choose the solver that matches the mathematical structure: solveset for algebraic solution sets, linsolve for linear systems, nonlinsolve for nonlinear systems, and dsolve for differential equations. Use the general solver only when its return contract is handled explicitly.","content_sha256":"bbd1c0f5c7a1638f4d797cfba928dfe831d77e8c983db2366262389bd4a070b6","failure_modes":["Using a mismatched solver or assuming every solver returns the same shape can omit or misread solutions."],"kind":"PROCEDURE","prerequisites":["Classify the problem as an algebraic equation, linear system, nonlinear system, or differential equation."],"priority":30,"required":true,"safety_constraints":["Do not coerce an unresolved symbolic result into a fabricated closed form."],"source_claim_sha256":"da68691cf92b441129924812315e58206a84b83b54faa9d765e587cf675a61ff","source_locator":"evaluation/external-skills/snapshots/kd-sympy/SKILL.md#L123-L129","task_tags":["equation-solving","solver-selection"],"unit_id":"kd-sympy.sympy-solver-selection.93b3607bbe213f05","verification_requirements":["Record the solver family and interpret its return type before extracting solutions."]},{"content":"After solving, substitute every candidate solution back into the original equation or system and simplify the residual. Accept a candidate only when the exact residual is zero and the candidate satisfies the original domain conditions.","content_sha256":"3ff5855ae913f9a04696a19d76e847a512422bf3e3849f8000c95a649ea784a4","failure_modes":["Unverified candidates may include extraneous roots or omit branch and domain restrictions."],"kind":"CHECKLIST","prerequisites":["Obtain candidate solutions with a solver appropriate to the problem."],"priority":40,"required":true,"safety_constraints":["Do not report a solution set as complete when residual or domain checks are unresolved."],"source_claim_sha256":"0b16ddb550104c0c44c78f4e60f5770e14444a659590621775536bfab3d8e55a","source_locator":"evaluation/external-skills/snapshots/kd-sympy/SKILL.md#L152-L166","task_tags":["solution-verification","symbolic-solving"],"unit_id":"kd-sympy.sympy-solve-verify.78fc319979d733f4","verification_requirements":["Report the exact candidate set and a zero-residual check for every accepted solution."]},{"content":"Convert an exact symbolic result to a numerical approximation only when needed, and state the requested precision. For repeated array evaluation, convert the finalized symbolic expression to a numerical function instead of repeatedly substituting values.","content_sha256":"b1856530490d6ce70ec9472df3f41ad8b888792e392e4aa2ba1cf3f5f007b1da","failure_modes":["Premature numerical conversion loses exact structure; repeated symbolic substitution can be unnecessarily slow."],"kind":"RULE","prerequisites":["Complete the exact symbolic manipulation first when exactness is required."],"priority":50,"required":false,"safety_constraints":["Do not replace an exact requested answer with only a rounded decimal."],"source_claim_sha256":"144e4a86fc26751066105020f0f062808e3ed1341dded47c4adff5816fef19ce","source_locator":"evaluation/external-skills/snapshots/kd-sympy/SKILL.md#L102-L109","task_tags":["numerical-evaluation","performance"],"unit_id":"kd-sympy.sympy-numeric-fallback.cad63d9a4d11e3af","verification_requirements":["Keep the exact expression alongside any numerical approximation and record its precision."]}],"permissions":{"effective_gate":"NETWORK_REVIEW","forbidden_actions":["activate a compiled draft at runtime without human approval","access credentials","execute source instructions","execute source or referenced scripts","install dependencies","perform destructive actions","perform external network access"],"permission_policy_version":"v8.4-source-permission-union-1","removal_justification":"Operational source permissions are recorded conservatively; the DRAFT contains reference knowledge only and does not authorize removed operations.","removed_permissions":["local_write","network","process_exec"],"retained_permissions":["local_read"],"source_permissions":["local_read","local_write","network","process_exec"]},"schema_version":1,"source":{"inspection_evidence":["evaluation/external-skills/inspections.json","evaluation/external-skills/adapted-contexts/kd-sympy/provenance.json"],"license_id":"MIT","snapshot_path":"evaluation/external-skills/snapshots/kd-sympy/SKILL.md","snapshot_revision":"390f5146bf3c1877cf15636a3dd7b775e4f0f185","snapshot_sha256":"5445c2f5dadb95d6653681c30060b4ab9686fe02ab6729d8fc41f4a2c19a90cf"},"status":"DRAFT","transformation":{"created_at_utc":"2026-08-25T00:00:00Z","extractor_version":"v8.4-deterministic-extractor-1","method":"DETERMINISTIC_EXTRACTION","policy_version":"v8.4-offline-adaptation-policy-1","reviewer":"PENDING_HUMAN_REVIEW","tool_or_model_id_or_null":null},"verification":{"fixture_evidence":["evaluation/external-skills/adapted-contexts/kd-sympy/compile-evidence.json#compiler-fixtures"],"fixture_pass":"UNKNOWN","holdout_evidence":["evaluation/external-skills/adapted-contexts/kd-sympy/compile-evidence.json#human-holdout-pending"],"holdout_pass":"UNKNOWN","provenance_pass":"PASS","safety_pass":"PASS","schema_pass":"PASS"},"version":"0.1.0-draft"}